research/salaries/workforce/profiles/raw/wp2022_ind_progress.csv

Ministry_Key,Des_Grp,Employee_Type,2020_pc,2022_pc
AEST,WOM,ALL,64.3,65.3
AEST,VM,ALL,21.5,19.5
AEST,IND,ALL,5.2,5.4
AEST,DIS,ALL,NA,24.3
AEST,WOM,AUX,46.7,63.6
AEST,VM,AUX,35.7,S
AEST,IND,AUX,S,S
AEST,DIS,AUX,NA,28.6
AEST,WOM,REG,65,65.4
AEST,VM,REG,20.9,S
AEST,IND,REG,S,S
AEST,DIS,REG,NA,24
AFF,WOM,ALL,56.7,56.4
AFF,VM,ALL,20.2,23
AFF,IND,ALL,2.6,2.1
AFF,DIS,ALL,NA,18.3
AFF,WOM,AUX,57.5,58.6
AFF,VM,AUX,22.2,14.3
AFF,IND,AUX,S,S
AFF,DIS,AUX,NA,33.3
AFF,WOM,REG,56.7,56.2
AFF,VM,REG,20.1,23.7
AFF,IND,REG,S,S
AFF,DIS,REG,NA,16.9
AG,WOM,ALL,66.9,67.8
AG,VM,ALL,22.4,23.4
AG,IND,ALL,3.6,4
AG,DIS,ALL,NA,20
AG,WOM,AUX,71.8,75.3
AG,VM,AUX,25.6,32.9
AG,IND,AUX,7.6,6.3
AG,DIS,AUX,NA,20.6
AG,WOM,REG,66.6,67.2
AG,VM,REG,22.1,22.9
AG,IND,REG,3.4,3.8
AG,DIS,REG,NA,20
BCPS,WOM,ALL,61.8,62.7
BCPS,VM,ALL,20.5,21
BCPS,IND,ALL,4.7,4.5
BCPS,DIS,ALL,NA,21.8
BCPS,WOM,AUX,64.6,62.7
BCPS,VM,AUX,24,20
BCPS,IND,AUX,6.7,6.6
BCPS,DIS,AUX,NA,21.3
BCPS,WOM,REG,61.6,62.7
BCPS,VM,REG,20.3,21
BCPS,IND,REG,4.5,4.4
BCPS,DIS,REG,NA,21.9
BCPSA,WOM,ALL,73.3,74.3
BCPSA,VM,ALL,20.5,19.6
BCPSA,IND,ALL,4.6,4.3
BCPSA,DIS,ALL,NA,25.1
BCPSA,WOM,AUX,68.9,83.3
BCPSA,VM,AUX,19.5,17.6
BCPSA,IND,AUX,S,S
BCPSA,DIS,AUX,NA,14.3
BCPSA,WOM,REG,73.7,73.9
BCPSA,VM,REG,20.5,19.7
BCPSA,IND,REG,S,S
BCPSA,DIS,REG,NA,25.6
CFD,WOM,ALL,81.3,82.3
CFD,VM,ALL,20.8,20.8
CFD,IND,ALL,7.4,7
CFD,DIS,ALL,NA,23.5
CFD,WOM,AUX,75.2,76.3
CFD,VM,AUX,24.5,22.9
CFD,IND,AUX,8.8,6.6
CFD,DIS,AUX,NA,22.7
CFD,WOM,REG,81.7,82.6
CFD,VM,REG,20.6,20.8
CFD,IND,REG,7.3,7
CFD,DIS,REG,NA,23.5
CITZ,WOM,ALL,57.5,59
CITZ,VM,ALL,20.6,22.1
CITZ,IND,ALL,3.9,3.7
CITZ,DIS,ALL,NA,22.3
CITZ,WOM,AUX,60.1,68.2
CITZ,VM,AUX,24.8,30.3
CITZ,IND,AUX,5.1,4.7
CITZ,DIS,AUX,NA,24.2
CITZ,WOM,REG,57.3,58.1
CITZ,VM,REG,20.3,21.6
CITZ,IND,REG,3.9,3.6
CITZ,DIS,REG,NA,22.1
EAO,WOM,ALL,56.3,58.9
EAO,VM,ALL,10.8,10.7
EAO,IND,ALL,3.6,S
EAO,DIS,ALL,NA,13
EAO,WOM,AUX,66.7,50
EAO,VM,AUX,S,S
EAO,IND,AUX,S,S
EAO,DIS,AUX,NA,S
EAO,WOM,REG,55.6,59.5
EAO,VM,REG,S,S
EAO,IND,REG,S,S
EAO,DIS,REG,NA,S
EDUC,WOM,ALL,62,60.5
EDUC,VM,ALL,21.2,22.4
EDUC,IND,ALL,3.4,3.2
EDUC,DIS,ALL,NA,20.5
EDUC,WOM,AUX,48.1,54.8
EDUC,VM,AUX,41.7,30
EDUC,IND,AUX,12,S
EDUC,DIS,AUX,NA,27.6
EDUC,WOM,REG,63,61
EDUC,VM,REG,19.8,21.9
EDUC,IND,REG,2.8,S
EDUC,DIS,REG,NA,19.9
EMBC,WOM,ALL,57.9,59.9
EMBC,VM,ALL,10.5,8.9
EMBC,IND,ALL,4.4,9.3
EMBC,DIS,ALL,NA,22.5
EMBC,WOM,AUX,53.3,68.1
EMBC,VM,AUX,10.7,7.7
EMBC,IND,AUX,10.7,13
EMBC,DIS,AUX,NA,22
EMBC,WOM,REG,58.8,57.8
EMBC,VM,REG,10.5,9.2
EMBC,IND,REG,3.2,8.3
EMBC,DIS,REG,NA,22.6
EMLI,WOM,ALL,51,54.6
EMLI,VM,ALL,12.5,13.8
EMLI,IND,ALL,3.4,2.6
EMLI,DIS,ALL,NA,21.7
EMLI,WOM,AUX,45.5,75
EMLI,VM,AUX,30,S
EMLI,IND,AUX,S,S
EMLI,DIS,AUX,NA,S
EMLI,WOM,REG,51.3,53.7
EMLI,VM,REG,11.5,S
EMLI,IND,REG,S,S
EMLI,DIS,REG,NA,S
ENV,WOM,ALL,46.4,50
ENV,VM,ALL,13.4,12.6
ENV,IND,ALL,3.7,3.7
ENV,DIS,ALL,NA,22.2
ENV,WOM,AUX,47.6,51.1
ENV,VM,AUX,20,20
ENV,IND,AUX,S,5.3
ENV,DIS,AUX,NA,19.8
ENV,WOM,REG,46.3,49.9
ENV,VM,REG,13.1,12
ENV,IND,REG,S,3.6
ENV,DIS,REG,NA,22.4
FIN,WOM,ALL,57.9,58.4
FIN,VM,ALL,31.1,31.4
FIN,IND,ALL,2.5,2
FIN,DIS,ALL,NA,21.6
FIN,WOM,AUX,59.1,39.1
FIN,VM,AUX,20,25
FIN,IND,AUX,S,S
FIN,DIS,AUX,NA,19
FIN,WOM,REG,57.9,58.7
FIN,VM,REG,31.3,31.5
FIN,IND,REG,S,S
FIN,DIS,REG,NA,21.7
FLNRORD,WOM,ALL,48.2,49.7
FLNRORD,VM,ALL,10.3,10.2
FLNRORD,IND,ALL,4.8,4.7
FLNRORD,DIS,ALL,NA,18.1
FLNRORD,WOM,AUX,51.8,46.6
FLNRORD,VM,AUX,15.1,8.6
FLNRORD,IND,AUX,9,7.8
FLNRORD,DIS,AUX,NA,18.4
FLNRORD,WOM,REG,47.8,50.2
FLNRORD,VM,REG,9.8,10.4
FLNRORD,IND,REG,4.4,4.3
FLNRORD,DIS,REG,NA,18.1
GCPE,WOM,ALL,63.2,61.7
GCPE,VM,ALL,14.2,15.8
GCPE,IND,ALL,3,3.1
GCPE,DIS,ALL,NA,25.6
GCPE,WOM,AUX,0.0,S
GCPE,VM,AUX,0.0,S
GCPE,IND,AUX,0.0,S
GCPE,DIS,AUX,NA,S
GCPE,WOM,REG,63.2,S
GCPE,VM,REG,14.2,S
GCPE,IND,REG,3,S
GCPE,DIS,REG,NA,S
HLTH,WOM,ALL,66.3,66.7
HLTH,VM,ALL,26,29.5
HLTH,IND,ALL,2.6,2.3
HLTH,DIS,ALL,NA,25
HLTH,WOM,AUX,80,74.7
HLTH,VM,AUX,37.3,51.1
HLTH,IND,AUX,S,S
HLTH,DIS,AUX,NA,24.4
HLTH,WOM,REG,65.6,66.2
HLTH,VM,REG,25.5,28.7
HLTH,IND,REG,S,S
HLTH,DIS,REG,NA,25.1
IRR,WOM,ALL,61.5,63.8
IRR,VM,ALL,12.3,9
IRR,IND,ALL,9.3,11.5
IRR,DIS,ALL,NA,28.2
IRR,WOM,AUX,50,70
IRR,VM,AUX,S,S
IRR,IND,AUX,S,S
IRR,DIS,AUX,NA,S
IRR,WOM,REG,61.9,63.6
IRR,VM,REG,S,S
IRR,IND,REG,S,S
IRR,DIS,REG,NA,S
JERI,WOM,ALL,58.5,57.6
JERI,VM,ALL,32,33.5
JERI,IND,ALL,2.5,2.2
JERI,DIS,ALL,NA,17.1
JERI,WOM,AUX,65,66.7
JERI,VM,AUX,31.6,S
JERI,IND,AUX,S,S
JERI,DIS,AUX,NA,S
JERI,WOM,REG,57.8,57
JERI,VM,REG,32,S
JERI,IND,REG,S,S
JERI,DIS,REG,NA,S
LBR,WOM,ALL,64.1,63.5
LBR,VM,ALL,23.7,23.6
LBR,IND,ALL,2.5,2.6
LBR,DIS,ALL,NA,29
LBR,WOM,AUX,57.1,60.9
LBR,VM,AUX,32.4,42.9
LBR,IND,AUX,S,S
LBR,DIS,AUX,NA,28.6
LBR,WOM,REG,65.2,63.8
LBR,VM,REG,22.3,22.2
LBR,IND,REG,S,S
LBR,DIS,REG,NA,29.1
MHA,WOM,ALL,80.3,74.3
MHA,VM,ALL,22,21.7
MHA,IND,ALL,5.1,5.4
MHA,DIS,ALL,NA,29
MHA,WOM,AUX,80,S
MHA,VM,AUX,S,S
MHA,IND,AUX,S,S
MHA,DIS,AUX,NA,S
MHA,WOM,REG,80.4,S
MHA,VM,REG,S,S
MHA,IND,REG,S,S
MHA,DIS,REG,NA,S
MUNI,WOM,ALL,61.6,61.5
MUNI,VM,ALL,30.6,29.5
MUNI,IND,ALL,3.3,1.8
MUNI,DIS,ALL,NA,22.7
MUNI,WOM,AUX,68.4,80
MUNI,VM,AUX,42.1,S
MUNI,IND,AUX,S,S
MUNI,DIS,AUX,NA,26.7
MUNI,WOM,REG,61.2,60.6
MUNI,VM,REG,29.9,S
MUNI,IND,REG,S,S
MUNI,DIS,REG,NA,22.5
OHCS,WOM,ALL,59,59.3
OHCS,VM,ALL,28.4,26.7
OHCS,IND,ALL,2.4,4.1
OHCS,DIS,ALL,NA,24.4
OHCS,WOM,AUX,55.6,S
OHCS,VM,AUX,S,S
OHCS,IND,AUX,S,S
OHCS,DIS,AUX,NA,S
OHCS,WOM,REG,59.1,S
OHCS,VM,REG,S,S
OHCS,IND,REG,S,S
OHCS,DIS,REG,NA,S
PGT,WOM,ALL,75.2,71.2
PGT,VM,ALL,40.9,48.6
PGT,IND,ALL,2.7,2.6
PGT,DIS,ALL,NA,18.1
PGT,WOM,AUX,81.8,56.5
PGT,VM,AUX,55,62.5
PGT,IND,AUX,S,S
PGT,DIS,AUX,NA,22.7
PGT,WOM,REG,74.6,72.6
PGT,VM,REG,39.7,47.6
PGT,IND,REG,S,S
PGT,DIS,REG,NA,17.6
PO,WOM,ALL,75.9,76.7
PO,VM,ALL,12.3,14.5
PO,IND,ALL,S,S
PO,DIS,ALL,NA,9.4
PO,WOM,AUX,S,100
PO,VM,AUX,S,S
PO,IND,AUX,S,S
PO,DIS,AUX,NA,S
PO,WOM,REG,S,75
PO,VM,REG,S,S
PO,IND,REG,S,7
PO,DIS,REG,NA,S
PSSG,WOM,ALL,48.5,51.4
PSSG,VM,ALL,22.7,24.2
PSSG,IND,ALL,4.9,4.6
PSSG,DIS,ALL,NA,19
PSSG,WOM,AUX,75.4,76.9
PSSG,VM,AUX,25.2,12.5
PSSG,IND,AUX,3.8,8.9
PSSG,DIS,AUX,NA,10.3
PSSG,WOM,REG,47.5,50.6
PSSG,VM,REG,22.7,24.4
PSSG,IND,REG,4.9,4.5
PSSG,DIS,REG,NA,19.3
SDPR,WOM,ALL,76.8,75.3
SDPR,VM,ALL,24.2,24.5
SDPR,IND,ALL,4.7,4.9
SDPR,DIS,ALL,NA,29.9
SDPR,WOM,AUX,75,66.7
SDPR,VM,AUX,28,17.6
SDPR,IND,AUX,5.6,S
SDPR,DIS,AUX,NA,29
SDPR,WOM,REG,76.9,75.5
SDPR,VM,REG,24,24.6
SDPR,IND,REG,4.7,S
SDPR,DIS,REG,NA,29.9
TACS,WOM,ALL,71.4,80.9
TACS,VM,ALL,19.4,9.8
TACS,IND,ALL,4.5,4.4
TACS,DIS,ALL,NA,31.3
TACS,WOM,AUX,S,100
TACS,VM,AUX,S,S
TACS,IND,AUX,S,S
TACS,DIS,AUX,NA,S
TACS,WOM,REG,S,79.7
TACS,VM,REG,S,S
TACS,IND,REG,S,S
TACS,DIS,REG,NA,S
TRAN,WOM,ALL,43.1,46.1
TRAN,VM,ALL,19.3,19
TRAN,IND,ALL,5.2,5.4
TRAN,DIS,ALL,NA,19.5
TRAN,WOM,AUX,52.2,57.6
TRAN,VM,AUX,15.3,11.1
TRAN,IND,AUX,10.2,9
TRAN,DIS,AUX,NA,27.9
TRAN,WOM,REG,42.5,45.4
TRAN,VM,REG,19.6,19.3
TRAN,IND,REG,4.9,5.2
TRAN,DIS,REG,NA,19

research/health-geography/boundary-estimates.md

### South Fraser · boards 5

Independent source drawing / modern combination overlap: 46.1% intersection over union.

- Closest individual lha: Langley (231); 20.8% drawing IoU.
- Closest individual hsda: Fraser South (23); 46.1% drawing IoU.
- Closest individual ha: Fraser (2); 3.2% drawing IoU.
- Closest individual regionalDistricts: Metro Vancouver Regional District (MVRD); 15.0% drawing IoU.
- Closest individual municipalities: City of Surrey (119); 27.6% drawing IoU.
- Closest individual schoolDistricts: Surrey (36); 28.9% drawing IoU.

### Northern Interior · boards 8

- Closest individual lha: Prince George (524); 48.5% drawing IoU.
- Closest individual hsda: Northern Interior (52); 80.9% drawing IoU.
- Closest individual ha: Northern (5); 23.5% drawing IoU.
- Closest individual regionalDistricts: Regional District of Bulkley-Nechako (RDBN); 43.4% drawing IoU.
- Closest individual municipalities: City of Prince George (38); 0.2% drawing IoU.
- Closest individual schoolDistricts: Nechako Lakes (91); 43.6% drawing IoU.

### North Shore · boards 10

Independent source drawing / modern combination overlap: 49.9% intersection over union.

### Creston and District · councils 5

- Closest individual lha: Creston (115); 84.9% drawing IoU.
- Closest individual hsda: East Kootenay (11); 7.4% drawing IoU.
- Closest individual ha: Interior (1); 1.6% drawing IoU.
- Closest individual regionalDistricts: Regional District of Central Kootenay (RDCK); 14.5% drawing IoU.
- Closest individual municipalities: Town of Creston (178); 0.2% drawing IoU.
- Closest individual schoolDistricts: Kootenay Lake (8); 22.2% drawing IoU.

### Campbell River/Nootka · councils 20

Independent source drawing / modern combination overlap: 66.9% intersection over union.

### Central Coast · councils 22

Independent source drawing / modern combination overlap: 39.7% intersection over union.

### Terrace and Area · councils 28

- Closest individual lha: Terrace (517); 84.1% drawing IoU.
- Closest individual hsda: Northwest (51); 5.3% drawing IoU.
- Closest individual ha: Northern (5); 2.2% drawing IoU.
- Closest individual regionalDistricts: Regional District of Kitimat-Stikine (RDKS); 10.8% drawing IoU.
- Closest individual municipalities: City of Terrace (52); 0.4% drawing IoU.
- Closest individual schoolDistricts: Coast Mountains (82); 15.3% drawing IoU.

### Kitimat and Area · councils 29

Independent source drawing / modern combination overlap: 61.9% intersection over union.

- Closest individual lha: Kitimat (515); 61.9% drawing IoU.
- Closest individual hsda: Northwest (51); 5.1% drawing IoU.
- Closest individual ha: Northern (5); 2.1% drawing IoU.
- Closest individual regionalDistricts: Regional District of Kitimat-Stikine (RDKS); 10.6% drawing IoU.
- Closest individual municipalities: District of Kitimat (48); 2.2% drawing IoU.
- Closest individual schoolDistricts: Coast Mountains (82); 15.1% drawing IoU.

### North Coast · councils 30

Independent source drawing / modern combination overlap: 61.9% intersection over union.

- Closest individual lha: Prince Rupert (512); 61.9% drawing IoU.
- Closest individual hsda: Northwest (51); 1.9% drawing IoU.
- Closest individual ha: Northern (5); 0.8% drawing IoU.
- Closest individual regionalDistricts: North Coast Regional District (NCRD); 8.3% drawing IoU.
- Closest individual municipalities: District of Port Edward (76); 2.8% drawing IoU.
- Closest individual schoolDistricts: Prince Rupert (52); 24.5% drawing IoU.

### Queen Charlotte Islands/Haida Gwaii · councils 31

- Closest individual lha: Haida Gwaii (510); 56.9% drawing IoU.
- Closest individual hsda: Northwest (51); 2.8% drawing IoU.
- Closest individual ha: Northern (5); 1.2% drawing IoU.
- Closest individual regionalDistricts: North Coast Regional District (NCRD); 14.2% drawing IoU.
- Closest individual municipalities: Village of Daajing Giids (73); 0.7% drawing IoU.
- Closest individual schoolDistricts: Haida Gwaii (50); 21.3% drawing IoU.

### Nisga'a Health Authority · councils 32

Independent source drawing / modern combination overlap: 65.2% intersection over union.

- Closest individual lha: Nisga'a (518); 65.2% drawing IoU.
- Closest individual hsda: Northwest (51); 1.6% drawing IoU.
- Closest individual ha: Northern (5); 0.7% drawing IoU.
- Closest individual regionalDistricts: Regional District of Kitimat-Stikine (RDKS); 3.3% drawing IoU.
- Closest individual schoolDistricts: Nisgaa (92); 74.2% drawing IoU.

### Snow Country · councils 33

- Closest individual lha: Snow Country (511); 82.5% drawing IoU.
- Closest individual hsda: Northwest (51); 10.4% drawing IoU.
- Closest individual ha: Northern (5); 4.3% drawing IoU.
- Closest individual regionalDistricts: Regional District of Kitimat-Stikine (RDKS); 21.7% drawing IoU.
- Closest individual municipalities: District of Stewart (51); 2.1% drawing IoU.
- Closest individual schoolDistricts: Coast Mountains (82); 30.9% drawing IoU.

### Stikine · councils 34

- Closest individual lha: Stikine (516); 79.9% drawing IoU.
- Closest individual hsda: Northwest (51); 60.1% drawing IoU.
- Closest individual ha: Northern (5); 25.5% drawing IoU.
- Closest individual regionalDistricts: Stikine Region (Unincorporated) (Stikine Region); 70.5% drawing IoU.
- Closest individual municipalities: Northern Rockies Regional Municipality (59); 0.1% drawing IoU.
- Closest individual schoolDistricts: Stikine (87); 79.0% drawing IoU.

### East Kootenay · societies 1

- Closest individual lha: Golden (116); 28.4% drawing IoU.
- Closest individual hsda: East Kootenay (11); 95.8% drawing IoU.
- Closest individual ha: Interior (1); 20.8% drawing IoU.
- Closest individual regionalDistricts: Regional District of East Kootenay (RDEK); 60.0% drawing IoU.
- Closest individual municipalities: District of Sparwood (214); 0.4% drawing IoU.
- Closest individual schoolDistricts: Rocky Mountain (6); 61.4% drawing IoU.

### Coast Garibaldi · societies 3

Independent source drawing / modern combination overlap: 76.3% intersection over union.

- Closest individual lha: Howe Sound (335); 42.1% drawing IoU.
- Closest individual hsda: North Shore/Coast Garibaldi (33); 28.5% drawing IoU.
- Closest individual ha: Vancouver Coastal (3); 28.4% drawing IoU.
- Closest individual regionalDistricts: Squamish-Lillooet Regional District (SLRD); 31.4% drawing IoU.
- Closest individual municipalities: Resort Municipality of Whistler (145); 1.3% drawing IoU.
- Closest individual schoolDistricts: Sea to Sky (48); 42.3% drawing IoU.

### Upper Island/Central Coast · societies 4

- Closest individual lha: Vancouver Island North (434); 31.8% drawing IoU.
- Closest individual hsda: North Vancouver Island (43); 59.1% drawing IoU.
- Closest individual ha: Vancouver Island (4); 48.6% drawing IoU.
- Closest individual regionalDistricts: Regional District of Mount Waddington (RDMW); 32.4% drawing IoU.
- Closest individual municipalities: City of Campbell River (338); 0.1% drawing IoU.
- Closest individual schoolDistricts: Vancouver Island North (85); 32.4% drawing IoU.